<?xml version="1.0" encoding="UTF-8"?>
<!--
  The MIT License
  
  Copyright (c) 2011 David Waltermire
  
  Permission is hereby granted, free of charge, to any person obtaining a copy
  of this software and associated documentation files (the "Software"), to deal
  in the Software without restriction, including without limitation the rights
  to use, copy, modify, merge, publish, distribute, sublicense, and/or sell
  copies of the Software, and to permit persons to whom the Software is
  furnished to do so, subject to the following conditions:
  
  The above copyright notice and this permission notice shall be included in
  all copies or substantial portions of the Software.
  
  THE SOFTWARE IS PROVIDED "AS IS", WITHOUT WARRANTY OF ANY KIND, EXPRESS OR
  IMPLIED, INCLUDING BUT NOT LIMITED TO THE WARRANTIES OF MERCHANTABILITY,
  FITNESS FOR A PARTICULAR PURPOSE AND NONINFRINGEMENT. IN NO EVENT SHALL THE
  AUTHORS OR COPYRIGHT HOLDERS BE LIABLE FOR ANY CLAIM, DAMAGES OR OTHER
  LIABILITY, WHETHER IN AN ACTION OF CONTRACT, TORT OR OTHERWISE, ARISING FROM,
  OUT OF OR IN CONNECTION WITH THE SOFTWARE OR THE USE OR OTHER DEALINGS IN
  THE SOFTWARE.
-->
<meta-model xmlns="http://scapdev.org/schema/meta-model/0.1"
  xmlns:oval-def="http://oval.mitre.org/XMLSchema/oval-definitions-5"
  xmlns:nvd-vuln="http://scap.nist.gov/schema/feed/vulnerability/2.0"
  xmlns:xsi="http://www.w3.org/2001/XMLSchema-instance"
  xsi:schemaLocation="http://scapdev.org/schema/meta-model/0.1 ../../../../content-model/src/main/xsd/MetaModel.xsd">
  
  <external-identifiers>
    <external-identifier id="urn:scap-content:external-identifier:org.mitre:cve">
      <pattern>CVE-\d{4}-\d{4}</pattern>
    </external-identifier>
    <external-identifier id="urn:scap-content:external-identifier:org.mitre:cce-4">
      <pattern>CCE-\d+</pattern>
    </external-identifier>
    <external-identifier id="urn:scap-content:external-identifier:org.mitre:cce-5">
      <pattern>CCE-\d+-\d</pattern>
    </external-identifier>
    <external-identifier id="urn:scap-content:external-identifier:org.mitre:cwe">
      <pattern>CWE-\d+</pattern>
    </external-identifier>
    <external-identifier id="urn:scap-content:external-identifier:gov.nist:cpe-2-x">
      <pattern>[c][pP][eE]:/[AHOaho]?(:[A-Za-z0-9\._\-~%]*){0,6}</pattern>
    </external-identifier>
  </external-identifiers>

  <schemas>
    <!-- =================================================================== -->
    <!-- = OVAL 5.x                                                        = -->
    <!-- =================================================================== -->
    <schema id="urn:scap-content:schema:org.mitre:oval-definitions-5"
        namespace="http://oval.mitre.org/XMLSchema/oval-definitions-5"
        schemaLocation="../../../src/main/xsd/org/mitre/oval/XMLSchema/oval-definitions-schema.xsd"
        prefix="oval-def">
      <schema-node node="/xs:schema"/>
      
      <documents>
        <document id="urn:scap-content:document:org.mitre.oval:oval-document">
          <schema-node node="//xs:element[@name='oval_definitions']/xs:complexType"/>
          <generated-document-model>
            <entity-containers>
              <entity-container id="urn:scap-content:container:org.mitre.oval:definitions">
                <schema-node node="//xs:complexType[@name='DefinitionsType']/xs:sequence/xs:element[@ref='oval-def:definition']"/>
                <entity-ref id-ref="urn:scap-content:entity:org.mitre.oval:definition"/>
              </entity-container>
              <entity-container id="urn:scap-content:container:org.mitre.oval:tests">
                <schema-node node="//xs:complexType[@name='TestsType']/xs:sequence/xs:element[@ref='oval-def:test']"/>
                <entity-ref id-ref="urn:scap-content:entity:org.mitre.oval:test"/>
              </entity-container>
              <entity-container id="urn:scap-content:container:org.mitre.oval:objects">
                <schema-node node="//xs:complexType[@name='ObjectsType']/xs:sequence/xs:element[@ref='oval-def:object']"/>
                <entity-ref id-ref="urn:scap-content:entity:org.mitre.oval:object"/>
              </entity-container>
              <entity-container id="urn:scap-content:container:org.mitre.oval:states">
                <schema-node node="//xs:complexType[@name='StatesType']/xs:sequence/xs:element[@ref='oval-def:state']"/>
                <entity-ref id-ref="urn:scap-content:entity:org.mitre.oval:state"/>
              </entity-container>
              <entity-container id="urn:scap-content:container:org.mitre.oval:variables">
                <schema-node node="//xs:complexType[@name='VariablesType']/xs:sequence/xs:element[@ref='oval-def:variable']"/>
                <entity-ref id-ref="urn:scap-content:entity:org.mitre.oval:variable"/>
              </entity-container>
            </entity-containers>

            <generated-property-refs>
              <generated-property-ref id-ref="urn:scap-content:generated:org.mitre.oval:oval-generator"/>
              <generated-property-ref id-ref="urn:scap-content:generated:org.mitre.oval:oval-generator-schema-version">
                <value type="STATIC">5.8</value>
              </generated-property-ref>
              <generated-property-ref id-ref="urn:scap-content:generated:org.mitre.oval:oval-generator-timestamp">
                <value type="TIME">now</value>
              </generated-property-ref>
              <generated-property-ref id-ref="urn:scap-content:generated:org.mitre.oval:oval-generator-product-name">
                <value type="APP">product.cpe</value>
              </generated-property-ref>
              <generated-property-ref id-ref="urn:scap-content:generated:org.mitre.oval:oval-defintions"/>
              <generated-property-ref id-ref="urn:scap-content:generated:org.mitre.oval:oval-tests"/>
              <generated-property-ref id-ref="urn:scap-content:generated:org.mitre.oval:oval-objects"/>
              <generated-property-ref id-ref="urn:scap-content:generated:org.mitre.oval:oval-states"/>
              <generated-property-ref id-ref="urn:scap-content:generated:org.mitre.oval:oval-variables"/>
            </generated-property-refs>
          </generated-document-model>
        </document>
      </documents>
      
      <generated-properties>
        <generated-property id="urn:scap-content:generated:org.mitre.oval:oval-generator">
          <schema-node node="//xs:element[@name='oval_definitions']/xs:complexType/xs:sequence/xs:element[@name='generator']"/>
        </generated-property>
        <generated-property id="urn:scap-content:generated:org.mitre.oval:oval-defintions">
          <schema-node node="//xs:element[@name='oval_definitions']/xs:complexType/xs:sequence/xs:element[@name='definitions']"/>
        </generated-property>
        <generated-property id="urn:scap-content:generated:org.mitre.oval:oval-tests">
          <schema-node node="//xs:element[@name='oval_definitions']/xs:complexType/xs:sequence/xs:element[@name='tests']"/>
        </generated-property>
        <generated-property id="urn:scap-content:generated:org.mitre.oval:oval-objects">
          <schema-node node="//xs:element[@name='oval_definitions']/xs:complexType/xs:sequence/xs:element[@name='objects']"/>
        </generated-property>
        <generated-property id="urn:scap-content:generated:org.mitre.oval:oval-states">
          <schema-node node="//xs:element[@name='oval_definitions']/xs:complexType/xs:sequence/xs:element[@name='states']"/>
        </generated-property>
        <generated-property id="urn:scap-content:generated:org.mitre.oval:oval-variables">
          <schema-node node="//xs:element[@name='oval_definitions']/xs:complexType/xs:sequence/xs:element[@name='variables']"/>
        </generated-property>
      </generated-properties>

      <entities>
        <entity id="urn:scap-content:entity:org.mitre.oval:definition" local-part="definition">
          <schema-node node="//xs:complexType[@name='DefinitionType']"/>
          <key id="urn:scap-content:key:org.mitre.oval:definition">
            <field id="urn:scap-content:field:org.mitre.oval:definition">
              <schema-node node="xs:attribute[@name='id']"/>
            </field>
          </key>
          <identifier-mapping>
            <pattern-operation pattern="(oval:[A-Za-z0-9_\-\.]+:def:[1-9][0-9]*)">
              <field-value id-ref="urn:scap-content:field:org.mitre.oval:definition">$1</field-value>
            </pattern-operation>
          </identifier-mapping>
        </entity>
        <entity id="urn:scap-content:entity:org.mitre.oval:test">
          <schema-node node="//xs:complexType[@name='TestType']"/>
          <key id="urn:scap-content:key:org.mitre.oval:test">
            <field id="urn:scap-content:field:org.mitre.oval:test">
              <schema-node node="xs:attribute[@name='id']"/>
            </field>
          </key>
          <identifier-mapping>
            <pattern-operation pattern="(oval:[A-Za-z0-9_\-\.]+:tst:[1-9][0-9]*)">
              <field-value id-ref="urn:scap-content:field:org.mitre.oval:test">$1</field-value>
            </pattern-operation>
          </identifier-mapping>
        </entity>
        <entity id="urn:scap-content:entity:org.mitre.oval:object">
          <schema-node node="//xs:complexType[@name='ObjectType']"/>
          <key id="urn:scap-content:key:org.mitre.oval:object">
            <field id="urn:scap-content:field:org.mitre.oval:object">
              <schema-node node="xs:attribute[@name='id']"/>
            </field>
          </key>
          <identifier-mapping>
            <pattern-operation pattern="(oval:[A-Za-z0-9_\-\.]+:obj:[1-9][0-9]*)">
              <field-value id-ref="urn:scap-content:field:org.mitre.oval:object">$1</field-value>
            </pattern-operation>